{
  "devmapVersion": "1.0.0",
  "generatedAt": "2026-04-25T15:54:54.796Z",
  "feature": {
    "name": "owners",
    "displayName": "Owners",
    "summary": "The owners feature manages the full lifecycle of pet owner records across the microservices architecture, exposing CRUD endpoints in the customers-service and surfacing aggregated owner-plus-pet data through the API gateway. The gateway orchestrates reactive calls to the customers-service, which persists and retrieves Owner entities via Spring Data JPA, while the genai-service can also query and manipulate owner data through LLM-callable tools."
  },
  "repository": {
    "name": "spring-petclinic-microservices",
    "rootPath": "<repo>",
    "language": "java",
    "framework": "spring-boot",
    "microservices": [
      {
        "name": "admin-server",
        "module": "spring-petclinic-admin-server",
        "port": 9090
      },
      {
        "name": "api-gateway",
        "module": "spring-petclinic-api-gateway",
        "port": 8080
      },
      {
        "name": "config-server",
        "module": "spring-petclinic-config-server",
        "port": 8888
      },
      {
        "name": "customers-service",
        "module": "spring-petclinic-customers-service",
        "port": 8081
      },
      {
        "name": "discovery-server",
        "module": "spring-petclinic-discovery-server",
        "port": 8761
      },
      {
        "name": "genai-service",
        "module": "spring-petclinic-genai-service",
        "port": 8084
      },
      {
        "name": "vets-service",
        "module": "spring-petclinic-vets-service",
        "port": 8083
      },
      {
        "name": "visits-service",
        "module": "spring-petclinic-visits-service",
        "port": 8082
      }
    ]
  },
  "components": [
    {
      "id": "api.application.CustomersServiceClient",
      "fqn": "org.springframework.samples.petclinic.api.application.CustomersServiceClient",
      "simpleName": "CustomersServiceClient",
      "kind": "client",
      "microservice": "api-gateway",
      "filePath": "spring-petclinic-api-gateway/src/main/java/org/springframework/samples/petclinic/api/application/CustomersServiceClient.java",
      "loc": 42,
      "annotations": [
        "@Component"
      ],
      "publicMethods": [],
      "summary": "Fetches owner details from the customers-service using a reactive WebClient, enabling the API gateway to retrieve customer information for the owners feature.",
      "core": true
    },
    {
      "id": "customers.model.Owner",
      "fqn": "org.springframework.samples.petclinic.customers.model.Owner",
      "simpleName": "Owner",
      "kind": "entity",
      "microservice": "customers-service",
      "filePath": "spring-petclinic-customers-service/src/main/java/org/springframework/samples/petclinic/customers/model/Owner.java",
      "loc": 143,
      "annotations": [
        "@Entity",
        "@Table"
      ],
      "publicMethods": [],
      "summary": "Represents a pet owner with contact information and manages their associated pets through a one-to-many relationship, providing sorted access to pets and validation of required fields.",
      "core": true
    },
    {
      "id": "customers.model.OwnerRepository",
      "fqn": "org.springframework.samples.petclinic.customers.model.OwnerRepository",
      "simpleName": "OwnerRepository",
      "kind": "repository",
      "microservice": "customers-service",
      "filePath": "spring-petclinic-customers-service/src/main/java/org/springframework/samples/petclinic/customers/model/OwnerRepository.java",
      "loc": 31,
      "annotations": [],
      "publicMethods": [],
      "summary": "Provides Spring Data JPA persistence operations for Owner domain objects, enabling standard CRUD and query functionality with automatic method implementation based on naming conventions.",
      "core": true
    },
    {
      "id": "customers.web.OwnerResource",
      "fqn": "org.springframework.samples.petclinic.customers.web.OwnerResource",
      "simpleName": "OwnerResource",
      "kind": "controller",
      "microservice": "customers-service",
      "filePath": "spring-petclinic-customers-service/src/main/java/org/springframework/samples/petclinic/customers/web/OwnerResource.java",
      "loc": 93,
      "annotations": [
        "@RequestMapping",
        "@RestController",
        "@Timed"
      ],
      "publicMethods": [
        {
          "name": "createOwner",
          "signature": "createOwner(...)",
          "annotations": [
            "@PostMapping"
          ],
          "lineStart": 57
        },
        {
          "name": "findOwner",
          "signature": "findOwner(...)",
          "annotations": [
            "@GetMapping"
          ],
          "lineStart": 67
        },
        {
          "name": "findAll",
          "signature": "findAll(...)",
          "annotations": [
            "@GetMapping"
          ],
          "lineStart": 75
        },
        {
          "name": "updateOwner",
          "signature": "updateOwner(...)",
          "annotations": [
            "@PutMapping"
          ],
          "lineStart": 83
        }
      ],
      "summary": "Exposes REST endpoints at /owners to create, retrieve, and update owner records, delegating persistence to OwnerRepository and using OwnerEntityMapper for request/model conversion.",
      "core": true
    },
    {
      "id": "api.boundary.web.ApiGatewayController",
      "fqn": "org.springframework.samples.petclinic.api.boundary.web.ApiGatewayController",
      "simpleName": "ApiGatewayController",
      "kind": "controller",
      "microservice": "api-gateway",
      "filePath": "spring-petclinic-api-gateway/src/main/java/org/springframework/samples/petclinic/api/boundary/web/ApiGatewayController.java",
      "loc": 84,
      "annotations": [
        "@RestController",
        "@RequestMapping"
      ],
      "publicMethods": [
        {
          "name": "getOwnerDetails",
          "signature": "getOwnerDetails(...)",
          "annotations": [
            "@GetMapping"
          ],
          "lineStart": 54
        }
      ],
      "summary": "Aggregates owner and pet visit data from downstream services via reactive clients, applying circuit breaker resilience to the visits lookup and merging results into a unified OwnerDetails response.",
      "core": false
    },
    {
      "id": "api.dto.OwnerDetails",
      "fqn": "org.springframework.samples.petclinic.api.dto.OwnerDetails",
      "simpleName": "OwnerDetails",
      "kind": "dto",
      "microservice": "api-gateway",
      "filePath": "spring-petclinic-api-gateway/src/main/java/org/springframework/samples/petclinic/api/dto/OwnerDetails.java",
      "loc": 98,
      "annotations": [],
      "publicMethods": [],
      "summary": "Represents owner information including personal details and associated pets, providing a builder pattern for construction and a helper method to extract pet IDs for API responses.",
      "core": false
    },
    {
      "id": "customers.web.mapper.OwnerEntityMapper",
      "fqn": "org.springframework.samples.petclinic.customers.web.mapper.OwnerEntityMapper",
      "simpleName": "OwnerEntityMapper",
      "kind": "mapper",
      "microservice": "customers-service",
      "filePath": "spring-petclinic-customers-service/src/main/java/org/springframework/samples/petclinic/customers/web/mapper/OwnerEntityMapper.java",
      "loc": 20,
      "annotations": [
        "@Component"
      ],
      "publicMethods": [],
      "summary": "Maps incoming OwnerRequest data onto existing Owner entities by populating address, city, telephone, and name fields for the owners feature.",
      "core": false
    },
    {
      "id": "customers.web.OwnerRequest",
      "fqn": "org.springframework.samples.petclinic.customers.web.OwnerRequest",
      "simpleName": "OwnerRequest",
      "kind": "other",
      "microservice": "customers-service",
      "filePath": "spring-petclinic-customers-service/src/main/java/org/springframework/samples/petclinic/customers/web/OwnerRequest.java",
      "loc": 15,
      "annotations": [],
      "publicMethods": [],
      "summary": "Captures validated owner registration data including name, address, and phone number for the owners feature in the customers-service microservice.",
      "core": false
    },
    {
      "id": "genai.AIDataProvider",
      "fqn": "org.springframework.samples.petclinic.genai.AIDataProvider",
      "simpleName": "AIDataProvider",
      "kind": "service",
      "microservice": "genai-service",
      "filePath": "spring-petclinic-genai-service/src/main/java/org/springframework/samples/petclinic/genai/AIDataProvider.java",
      "loc": 94,
      "annotations": [
        "@Service"
      ],
      "publicMethods": [],
      "summary": "Provides LLM-invoked functions to query owner and vet data from the customers-service, including vector similarity search for vet matching and operations to add owners and pets to the system.",
      "core": false
    },
    {
      "id": "genai.dto.OwnerDetails",
      "fqn": "org.springframework.samples.petclinic.genai.dto.OwnerDetails",
      "simpleName": "OwnerDetails",
      "kind": "dto",
      "microservice": "genai-service",
      "filePath": "spring-petclinic-genai-service/src/main/java/org/springframework/samples/petclinic/genai/dto/OwnerDetails.java",
      "loc": 35,
      "annotations": [],
      "publicMethods": [],
      "summary": "Transfers owner information including personal details and associated pets between services in the genai-service microservice.",
      "core": false
    },
    {
      "id": "genai.PetclinicTools",
      "fqn": "org.springframework.samples.petclinic.genai.PetclinicTools",
      "simpleName": "PetclinicTools",
      "kind": "other",
      "microservice": "genai-service",
      "filePath": "spring-petclinic-genai-service/src/main/java/org/springframework/samples/petclinic/genai/PetclinicTools.java",
      "loc": 82,